{
  "schemaVersion": 1,
  "gameVersion": "7.55",
  "generatedFrom": "FFXIV game sheets exported by xivapi/ffxiv-datamining at c142b1269a76e9e3fffc42f984a5f193ba565ddc. Filter: non-PvP job-assigned player, proc, transformed, and limit-break actions in combat categories.",
  "actions": [
    {
      "actionId": 7541,
      "name": "Second Wind",
      "job": "VPR",
      "kind": "ability",
      "minimumLevel": 8,
      "castSeconds": 0,
      "recastSeconds": 120,
      "timelineLockSeconds": 0,
      "maximumCharges": 1,
      "source": "FFXIV 7.55 game data Action sheet; xivapi/ffxiv-datamining@c142b1269a76e9e3fffc42f984a5f193ba565ddc"
    },
    {
      "actionId": 7542,
      "name": "Bloodbath",
      "job": "VPR",
      "kind": "ability",
      "minimumLevel": 12,
      "castSeconds": 0,
      "recastSeconds": 90,
      "timelineLockSeconds": 0,
      "maximumCharges": 1,
      "source": "FFXIV 7.55 game data Action sheet; xivapi/ffxiv-datamining@c142b1269a76e9e3fffc42f984a5f193ba565ddc"
    },
    {
      "actionId": 7546,
      "name": "True North",
      "job": "VPR",
      "kind": "ability",
      "minimumLevel": 50,
      "castSeconds": 0,
      "recastSeconds": 45,
      "timelineLockSeconds": 0,
      "maximumCharges": 2,
      "source": "FFXIV 7.55 game data Action sheet; xivapi/ffxiv-datamining@c142b1269a76e9e3fffc42f984a5f193ba565ddc"
    },
    {
      "actionId": 7548,
      "name": "Arm's Length",
      "job": "VPR",
      "kind": "ability",
      "minimumLevel": 32,
      "castSeconds": 0,
      "recastSeconds": 120,
      "timelineLockSeconds": 0,
      "maximumCharges": 1,
      "source": "FFXIV 7.55 game data Action sheet; xivapi/ffxiv-datamining@c142b1269a76e9e3fffc42f984a5f193ba565ddc"
    },
    {
      "actionId": 7549,
      "name": "Feint",
      "job": "VPR",
      "kind": "ability",
      "minimumLevel": 22,
      "castSeconds": 0,
      "recastSeconds": 90,
      "timelineLockSeconds": 0,
      "maximumCharges": 1,
      "source": "FFXIV 7.55 game data Action sheet; xivapi/ffxiv-datamining@c142b1269a76e9e3fffc42f984a5f193ba565ddc"
    },
    {
      "actionId": 7863,
      "name": "Leg Sweep",
      "job": "VPR",
      "kind": "ability",
      "minimumLevel": 10,
      "castSeconds": 0,
      "recastSeconds": 40,
      "timelineLockSeconds": 0,
      "maximumCharges": 1,
      "source": "FFXIV 7.55 game data Action sheet; xivapi/ffxiv-datamining@c142b1269a76e9e3fffc42f984a5f193ba565ddc"
    },
    {
      "actionId": 34606,
      "name": "Steel Fangs",
      "job": "VPR",
      "kind": "weaponskill",
      "minimumLevel": 1,
      "castSeconds": 0,
      "recastSeconds": 2.5,
      "timelineLockSeconds": 2.5,
      "maximumCharges": 1,
      "source": "FFXIV 7.55 game data Action sheet; xivapi/ffxiv-datamining@c142b1269a76e9e3fffc42f984a5f193ba565ddc"
    },
    {
      "actionId": 34607,
      "name": "Reaving Fangs",
      "job": "VPR",
      "kind": "weaponskill",
      "minimumLevel": 10,
      "castSeconds": 0,
      "recastSeconds": 2.5,
      "timelineLockSeconds": 2.5,
      "maximumCharges": 1,
      "source": "FFXIV 7.55 game data Action sheet; xivapi/ffxiv-datamining@c142b1269a76e9e3fffc42f984a5f193ba565ddc"
    },
    {
      "actionId": 34608,
      "name": "Hunter's Sting",
      "job": "VPR",
      "kind": "weaponskill",
      "minimumLevel": 5,
      "castSeconds": 0,
      "recastSeconds": 2.5,
      "timelineLockSeconds": 2.5,
      "maximumCharges": 1,
      "source": "FFXIV 7.55 game data Action sheet; xivapi/ffxiv-datamining@c142b1269a76e9e3fffc42f984a5f193ba565ddc",
      "comboFromActionId": 34606
    },
    {
      "actionId": 34609,
      "name": "Swiftskin's Sting",
      "job": "VPR",
      "kind": "weaponskill",
      "minimumLevel": 20,
      "castSeconds": 0,
      "recastSeconds": 2.5,
      "timelineLockSeconds": 2.5,
      "maximumCharges": 1,
      "source": "FFXIV 7.55 game data Action sheet; xivapi/ffxiv-datamining@c142b1269a76e9e3fffc42f984a5f193ba565ddc",
      "comboFromActionId": 34606
    },
    {
      "actionId": 34610,
      "name": "Flanksting Strike",
      "job": "VPR",
      "kind": "weaponskill",
      "minimumLevel": 30,
      "castSeconds": 0,
      "recastSeconds": 2.5,
      "timelineLockSeconds": 2.5,
      "maximumCharges": 1,
      "source": "FFXIV 7.55 game data Action sheet; xivapi/ffxiv-datamining@c142b1269a76e9e3fffc42f984a5f193ba565ddc",
      "comboFromActionId": 34608
    },
    {
      "actionId": 34611,
      "name": "Flanksbane Fang",
      "job": "VPR",
      "kind": "weaponskill",
      "minimumLevel": 30,
      "castSeconds": 0,
      "recastSeconds": 2.5,
      "timelineLockSeconds": 2.5,
      "maximumCharges": 1,
      "source": "FFXIV 7.55 game data Action sheet; xivapi/ffxiv-datamining@c142b1269a76e9e3fffc42f984a5f193ba565ddc",
      "comboFromActionId": 34608
    },
    {
      "actionId": 34612,
      "name": "Hindsting Strike",
      "job": "VPR",
      "kind": "weaponskill",
      "minimumLevel": 30,
      "castSeconds": 0,
      "recastSeconds": 2.5,
      "timelineLockSeconds": 2.5,
      "maximumCharges": 1,
      "source": "FFXIV 7.55 game data Action sheet; xivapi/ffxiv-datamining@c142b1269a76e9e3fffc42f984a5f193ba565ddc",
      "comboFromActionId": 34609
    },
    {
      "actionId": 34613,
      "name": "Hindsbane Fang",
      "job": "VPR",
      "kind": "weaponskill",
      "minimumLevel": 30,
      "castSeconds": 0,
      "recastSeconds": 2.5,
      "timelineLockSeconds": 2.5,
      "maximumCharges": 1,
      "source": "FFXIV 7.55 game data Action sheet; xivapi/ffxiv-datamining@c142b1269a76e9e3fffc42f984a5f193ba565ddc",
      "comboFromActionId": 34609
    },
    {
      "actionId": 34614,
      "name": "Steel Maw",
      "job": "VPR",
      "kind": "weaponskill",
      "minimumLevel": 25,
      "castSeconds": 0,
      "recastSeconds": 2.5,
      "timelineLockSeconds": 2.5,
      "maximumCharges": 1,
      "source": "FFXIV 7.55 game data Action sheet; xivapi/ffxiv-datamining@c142b1269a76e9e3fffc42f984a5f193ba565ddc"
    },
    {
      "actionId": 34615,
      "name": "Reaving Maw",
      "job": "VPR",
      "kind": "weaponskill",
      "minimumLevel": 35,
      "castSeconds": 0,
      "recastSeconds": 2.5,
      "timelineLockSeconds": 2.5,
      "maximumCharges": 1,
      "source": "FFXIV 7.55 game data Action sheet; xivapi/ffxiv-datamining@c142b1269a76e9e3fffc42f984a5f193ba565ddc"
    },
    {
      "actionId": 34616,
      "name": "Hunter's Bite",
      "job": "VPR",
      "kind": "weaponskill",
      "minimumLevel": 40,
      "castSeconds": 0,
      "recastSeconds": 2.5,
      "timelineLockSeconds": 2.5,
      "maximumCharges": 1,
      "source": "FFXIV 7.55 game data Action sheet; xivapi/ffxiv-datamining@c142b1269a76e9e3fffc42f984a5f193ba565ddc",
      "comboFromActionId": 34614
    },
    {
      "actionId": 34617,
      "name": "Swiftskin's Bite",
      "job": "VPR",
      "kind": "weaponskill",
      "minimumLevel": 45,
      "castSeconds": 0,
      "recastSeconds": 2.5,
      "timelineLockSeconds": 2.5,
      "maximumCharges": 1,
      "source": "FFXIV 7.55 game data Action sheet; xivapi/ffxiv-datamining@c142b1269a76e9e3fffc42f984a5f193ba565ddc",
      "comboFromActionId": 34614
    },
    {
      "actionId": 34618,
      "name": "Jagged Maw",
      "job": "VPR",
      "kind": "weaponskill",
      "minimumLevel": 50,
      "castSeconds": 0,
      "recastSeconds": 2.5,
      "timelineLockSeconds": 2.5,
      "maximumCharges": 1,
      "source": "FFXIV 7.55 game data Action sheet; xivapi/ffxiv-datamining@c142b1269a76e9e3fffc42f984a5f193ba565ddc",
      "comboFromActionId": 34616
    },
    {
      "actionId": 34619,
      "name": "Bloodied Maw",
      "job": "VPR",
      "kind": "weaponskill",
      "minimumLevel": 50,
      "castSeconds": 0,
      "recastSeconds": 2.5,
      "timelineLockSeconds": 2.5,
      "maximumCharges": 1,
      "source": "FFXIV 7.55 game data Action sheet; xivapi/ffxiv-datamining@c142b1269a76e9e3fffc42f984a5f193ba565ddc",
      "comboFromActionId": 34616
    },
    {
      "actionId": 34620,
      "name": "Vicewinder",
      "job": "VPR",
      "kind": "weaponskill",
      "minimumLevel": 65,
      "castSeconds": 0,
      "recastSeconds": 40,
      "timelineLockSeconds": 2.5,
      "maximumCharges": 2,
      "source": "FFXIV 7.55 game data Action sheet; xivapi/ffxiv-datamining@c142b1269a76e9e3fffc42f984a5f193ba565ddc"
    },
    {
      "actionId": 34621,
      "name": "Hunter's Coil",
      "job": "VPR",
      "kind": "weaponskill",
      "minimumLevel": 65,
      "castSeconds": 0,
      "recastSeconds": 3,
      "timelineLockSeconds": 3,
      "maximumCharges": 1,
      "source": "FFXIV 7.55 game data Action sheet; xivapi/ffxiv-datamining@c142b1269a76e9e3fffc42f984a5f193ba565ddc",
      "comboFromActionId": 34620
    },
    {
      "actionId": 34622,
      "name": "Swiftskin's Coil",
      "job": "VPR",
      "kind": "weaponskill",
      "minimumLevel": 65,
      "castSeconds": 0,
      "recastSeconds": 3,
      "timelineLockSeconds": 3,
      "maximumCharges": 1,
      "source": "FFXIV 7.55 game data Action sheet; xivapi/ffxiv-datamining@c142b1269a76e9e3fffc42f984a5f193ba565ddc",
      "comboFromActionId": 34620
    },
    {
      "actionId": 34623,
      "name": "Vicepit",
      "job": "VPR",
      "kind": "weaponskill",
      "minimumLevel": 70,
      "castSeconds": 0,
      "recastSeconds": 40,
      "timelineLockSeconds": 2.5,
      "maximumCharges": 2,
      "source": "FFXIV 7.55 game data Action sheet; xivapi/ffxiv-datamining@c142b1269a76e9e3fffc42f984a5f193ba565ddc"
    },
    {
      "actionId": 34624,
      "name": "Hunter's Den",
      "job": "VPR",
      "kind": "weaponskill",
      "minimumLevel": 70,
      "castSeconds": 0,
      "recastSeconds": 3,
      "timelineLockSeconds": 3,
      "maximumCharges": 1,
      "source": "FFXIV 7.55 game data Action sheet; xivapi/ffxiv-datamining@c142b1269a76e9e3fffc42f984a5f193ba565ddc",